{
  "contract": {
    "name": "mtb_logger_timeseries",
    "version": "0.2.0",
    "sidecar_kind": "generic"
  },
  "data_file": {
    "delimiter": ",",
    "header": true
  },
  "streams": {
    "primary": {
      "type": "uniform",
      "time_column": "timestamp",
      "time_encoding": "local_time",
      "time_unit": "time_of_day",
      "time_format": "HH:MM:SS.mmm",
      "sample_rate_hz": 1000.0
    }
  },
  "sensors": {
    "front_shock": {
      "source_config": "sensor0",
      "name": "front_shock",
      "type": "analog_pot",
      "domain": "wheel",
      "raw_unit": "counts",
      "calibration": {
        "type": "linear",
        "input_unit": "counts",
        "output_unit": "mm",
        "installed_zero_count": 4095,
        "sensor_zero_count": 0,
        "sensor_full_count": 4095,
        "sensor_full_travel": 203.0,
        "invert": false
      }
    },
    "rear_shock": {
      "source_config": "sensor1",
      "name": "rear_shock",
      "type": "analog_pot",
      "domain": "suspension",
      "raw_unit": "counts",
      "calibration": {
        "type": "linear",
        "input_unit": "counts",
        "output_unit": "mm",
        "installed_zero_count": 0,
        "sensor_zero_count": 0,
        "sensor_full_count": 4095,
        "sensor_full_travel": 78.0,
        "invert": false
      }
    }
  },
  "columns": {
    "sample_id": {
      "csv_ref": {
        "by": "header",
        "header": "sample_id"
      },
      "class": "index",
      "dtype": "uint32"
    },
    "timestamp": {
      "csv_ref": {
        "by": "header",
        "header": "timestamp"
      },
      "class": "time",
      "dtype": "string",
      "stream": "primary",
      "unit": "time_of_day"
    },
    "fork_travel_mm": {
      "csv_ref": {
        "by": "header",
        "header": "front_shock [mm]"
      },
      "class": "signal",
      "dtype": "float64",
      "stream": "primary",
      "sensor": "front_shock",
      "end": "front",
      "quantity": "disp",
      "domain": "wheel",
      "unit": "mm",
      "calibration_ref": "front_shock",
      "transform_chain": []
    },
    "fork_raw_counts": {
      "csv_ref": {
        "by": "header",
        "header": "front_shock_raw [counts]"
      },
      "class": "signal",
      "dtype": "float64",
      "stream": "primary",
      "sensor": "front_shock",
      "end": "front",
      "quantity": "raw",
      "domain": "suspension",
      "unit": "counts",
      "calibration_ref": "front_shock"
    },
    "shock_travel_mm": {
      "csv_ref": {
        "by": "header",
        "header": "rear_shock [mm]"
      },
      "class": "signal",
      "dtype": "float64",
      "stream": "primary",
      "sensor": "rear_shock",
      "end": "rear",
      "quantity": "disp",
      "domain": "wheel",
      "unit": "mm",
      "calibration_ref": "rear_shock",
      "transform_chain": []
    },
    "shock_raw_counts": {
      "csv_ref": {
        "by": "header",
        "header": "rear_shock_raw [counts]"
      },
      "class": "signal",
      "dtype": "float64",
      "stream": "primary",
      "sensor": "rear_shock",
      "end": "rear",
      "quantity": "raw",
      "domain": "suspension",
      "unit": "counts",
      "calibration_ref": "rear_shock"
    },
    "mark": {
      "csv_ref": {
        "by": "header",
        "header": "mark"
      },
      "class": "event_flag",
      "dtype": "bool",
      "stream": "primary",
      "meaning": "user mark"
    }
  },
  "qc": {
    "warnings": []
  },
  "provenance": {
    "logger_family": "BODAQS",
    "source_config": "loggercfg (16).txt",
    "metadata_generated_at": "2026-04-25T12:00:00+08:00",
    "generator": "manual generic sidecar example for preprocessing development",
    "assumptions": [
      "This is a generic fallback sidecar, so it intentionally does not include a runtime CSV filename, row count, hash, session id, or exact session start time.",
      "Current firmware header generation is assumed: sample_id,timestamp_ms,Fork [mm],Shock [mm],String pot [mm],String pot_raw [counts],mark.",
      "sensor0, sensor1, and sensor2 are assumed active because muted=false; sensor3 is omitted because muted=true.",
      "timestamp_mode=fast is represented as epoch_ms anchored to the Unix epoch in UTC.",
      "Fork, Shock, and String pot are interpreted as displacement signals because they have linear output_mode, mm units, and non-unity sensor_full_travel_mm values.",
      "All selected output_id values are identity and all active sensors use output_mode=LINEAR, so no transform registry entries are included."
    ]
  }
}
